<?xml version="1.0" encoding="utf-8" ?> 
<!-- This is a working example of a Major Havoc Profile -->
<GameProfile xmlns="http://askey.org/GameProfile"
             xmlns:xsi="http://www.w3.org/2001/XMLSchema-instance"
             xsi:schemaLocation="http://askey.org/GameProfile GameProfile.xsd"
             Version="1.0.0.0">
    <GameInfo>
        <Name>Major Havoc</Name>
        <Version>1.0</Version>
        <Manufacturer>Atari Inc.</Manufacturer>
        <ReleaseDate>1984-01</ReleaseDate>
        <Comment>Production ROMs</Comment>
    </GameInfo>
    <MemoryMap Id="AlphaProcessor"
               AddressWidth="16"
               AddressBase="0x0000"
               BusWidth="8">
        <ROM Id="PagedProgramRom"
             Address="0x2000"
             Size="0x2000">
            <Memory>
                <Bank Id="Bank_1Q">
                    <EPROM Id="EPROM_1Q"
                            Name="136025.215"
                            Size="16384"
                            Width="8"/>
                </Bank>
                <Bank Id="Bank_1NP">
                    <EPROM Id="EPROM_1NP"
                            Name="136025.216"
                            Size="16384"
                            Width="8"/>
                </Bank>
            </Memory>
            <Pages>
                <Page Id="PagedProgramRom.Page_0">
                    <BankRef Id="Bank_1Q" />
                </Page>
                <Page Id="PagedProgramRom.Page_1">
                    <BankRef Id="Bank_1Q" />
                </Page>
                <Page Id="PagedProgramRom.Page_2">
                    <BankRef Id="Bank_1NP" />
                </Page>
                <Page Id="PagedProgramRom.Page_3">
                    <BankRef Id="Bank_1NP" />
                </Page>
            </Pages>
        </ROM>
        <ROM Id="ProgramRom"
             Address="0x8000"
             Size="0x8000">
            <Memory>
                <Bank Id="Bank_1MN">
                    <EPROM Id="EPROM_1MN"
                            Name="136025.217"
                            Size="16384"
                            Width="8"/>
                </Bank>
                <Bank Id="Bank_1L">
                    <EPROM Id="EPROM_1L"
                            Name="136025.318"
                            Size="16384"
                            Width="8"/>
                </Bank>
            </Memory>
            <Pages>
                <Page Id="ProgramRom.Page_0">
                    <BankRef Id="Bank_1MN" />
                    <BankRef Id="Bank_1L" />
                </Page>
            </Pages>
        </ROM>
    </MemoryMap>
    <ProgramMemory>
        <TextSegment>
            <Data Id="AlphaProcessor.ProgramRom.Page_0"
                  Reserved="no"
                  Start="0x2000"
                  Length="0x0234"/>
            <Checksum Id="Checksum1L"
                      Type="Crc32">
                <EPROMRef Id="EPROM_1L"
                          Start="0x0000"
                          End="0xFFFF"/>
                <StorageDefinition Id="Checksum_1L">
                    <Array Type="short">
                        <PageRef Id="PagedProgramRom.Page_0">
                            0x1111
                        </PageRef>
                    </Array>
                </StorageDefinition>
            </Checksum>
        </TextSegment>
    </ProgramMemory>
    <!-- Individual Maze Features,
    The Maximum value represents total # allowed for all mazes combined. -->
    <Features>
        <Feature Id="MazeHint"
                 Maximum="12">
            <!--Not every level has a hint. -->
            <StorageDefinition>
                <Array Id="HintIndex"
                       Type="byte"
                       Storage="value"
                       Size="12">
                    <PageRef Id="ProgramRom.Page_0">
                        0x93FE
                    </PageRef>
                </Array>
                <Array Id="PointerToHintString"
                       Type="string"
                       Storage="pointer"
                       Size="12">
                    <PageRef Id="ProgramRom.Page_0">
                        0xE48b
                    </PageRef>
                </Array>
            </StorageDefinition>
        </Feature>
        <Feature Id="ReactoidTime"
                 Maximum="16">
            <!-- Every level MUST have a Reactoid timer value. -->
            <StorageDefinition >
                <Array Id="ReactoidMeltdownTimes"
                       Type="byte"
                       Storage="value"
                       Size="16">
                    <PageRef Id="PagedProgramRom.Page_1">
                        0x3355
                    </PageRef>
                </Array>
            </StorageDefinition>
        </Feature>
        <Feature Id="Reactoid"
                 Maximum="16">
            <!-- Every level MUST have a Reactoid. It's actually stored as
            the first maze object in the MazeEnemiesObjectList List.-->
            <StorageDefinition Id="MazeEnemiesList">
                <Array Id="MazeEnemiesList"
                       Type="object"
                       Storage="pointer"
                       Size="16">
                    <PageRef Id="PagedProgramRom.Page_0">
                        0x2581
                    </PageRef>
                </Array>
            </StorageDefinition>
        </Feature> 
        <Feature Id="Pyroid">
            <!-- Only one Reactoid ever, so no delimiter before the Pyroids. -->
            <StorageDefinitionRef Id="MazeEnemiesList"
                                  Order="1"/>
        </Feature>
        <Feature Id="Perkoid">
            <!-- May be many Pyroids in list already so use delimiter before
            inserting the Perkoids. -->
            <StorageDefinitionRef Id="MazeEnemiesList"
                                  Order="2">
                <Delimiter>
                    FE
                </Delimiter>
            </StorageDefinitionRef>
        </Feature>      
        <Feature Id="Oxoid">
            <StorageDefinition >
                <Array Id="OxoidList"
                       Type="object"
                       Storage="pointer"
                       Size="16">
                    <PageRef Id="PagedProgramRom.Page_1">
                        0x25A9
                    </PageRef>
                </Array>
            </StorageDefinition>
        </Feature>
        <Feature Id="Lightning">
            <StorageDefinition >
                <Array Id="LightningList"
                       Type="object"
                       Storage="pointer"
                       Size="16">
                    <PageRef Id="PagedProgramRom.Page_1">
                        0x25D1
                    </PageRef>
                </Array>
            </StorageDefinition>
        </Feature>
        <Feature Id="Arrow">
            <StorageDefinition >
                <Array Id="ArrowList"
                       Type="object"
                       Storage="pointer"
                       Size="16">
                    <PageRef Id="PagedProgramRom.Page_1">
                        0x25F9
                    </PageRef>
                </Array>
            </StorageDefinition>
        </Feature>
        <Feature Id="MazeWall">
            <StorageDefinition >
                <Array Id="MazeWallList"
                       Type="object"
                       Storage="pointer"
                       Size="16">
                    <PageRef Id="PagedProgramRom.Page_1">
                        0x2647
                    </PageRef>
                </Array>
            </StorageDefinition>
        </Feature>
        <Feature Id="OneWaySign">
            <StorageDefinition >
                <Array Id="OneWaySignList"
                       Type="object"
                       Storage="pointer"
                       Size="16">
                    <PageRef Id="PagedProgramRom.Page_1">
                        0x2677
                    </PageRef>
                </Array>
            </StorageDefinition>
        </Feature>
        <Feature Id="LockAndKey">
            <StorageDefinition >
                <Array Id="LockAndKeyList"
                       Type="object"
                       Storage="pointer"
                       Size="16">
                    <PageRef Id="PagedProgramRom.Page_1">
                        0x26D1
                    </PageRef>
                </Array>
            </StorageDefinition>
        </Feature>
        <Feature Id="Stalactite">
            <StorageDefinition >
                <Array Id="StalactiteList"
                       Type="object"
                       Storage="pointer"
                       Size="16">
                    <PageRef Id="PagedProgramRom.Page_1">
                        0x26B3
                    </PageRef>
                </Array>
            </StorageDefinition>
        </Feature>
        <Feature Id="EscapePod"
                 Maximum="4">
            <!-- Only Maze type 1 Supports Escape Pods. -->
            <StorageDefinition >
                <Array Id="EscapePodEnabled"
                       Type="boolean"
                       Storage="value"
                       Size="4">
                    <PageRef Id="PagedProgramRom.Page_1">
                        0x32FF
                    </PageRef>
                </Array>
            </StorageDefinition>
        </Feature>
        <Feature Id="Clock"
                 Maximum="16">
            <StorageDefinition >
                <Array Id="ClockEnabled"
                       Type="boolean"
                       Storage="value"
                       Size="16">